<?xml version="1.0" encoding="utf-8"?><!DOCTYPE list SYSTEM "phantomAI.dtd">
<list>

     <!-- СвС -->
	 
	<ClassObject classId="100" className="Sword Muse" sex="1">
		<ai_type type="b_fighter" sub_type="stupid" />
		<henna id1="169" id2="30"/>
		<nuke_skills>
			<skill id="986" level="25" /> <!-- Deadly Strike -->
		</nuke_skills>
		<rare_nuke_skills>
			<!-- Нету -->
		</rare_nuke_skills>
		<self_buff_skills>
			<skill id="988" level="3" /> <!-- Battle Whisper -->
		</self_buff_skills>
		<ultimate_self_buff_skills>
			<!-- Нету -->
		</ultimate_self_buff_skills>
		<debuff_skills>
			<skill id="98" level="5" />	<!-- Sword Symphony -->
			<skill id="407" level="10" /> <!-- Psycho Symphony -->
			<skill id="402" level="10" is_enchantable="true" is_random="false" ench_max_value="30" ench_route="2"/> <!-- Arrest -->
		</debuff_skills>
		<rare_debuff_skills>
			<skill id="437" level="1" is_enchantable="true" is_random="false" ench_max_value="15" ench_route="1"/> <!-- Song of Silence -->
		</rare_debuff_skills>
		<passive_skills>
			<skill id="631" level="6" />	<!-- Emergent Ability - Attack -->
			<skill id="652" level="1" />	<!-- Knight Ability - Defense -->
			<skill id="655" level="1" />	<!-- Enchanter Ability - Barrier -->
			<skill id="651" level="1" />	<!-- Warrior Ability - Haste -->
		</passive_skills>
		<consumble_skills>
			<skill id="6439" level="1" cond="MP;50"/> <!-- MP Potion, бот использует когда MP меньше 50% один раз -->
			<skill id="2166" level="1" cond="CP;90"/> <!-- CP Potion Low, бот использует когда CP меньше 90% -->
		</consumble_skills>
	</ClassObject>
 </list>