<?xml version="1.0" encoding="utf-8"?><!DOCTYPE list SYSTEM "phantomAI.dtd">
<list>

     <!-- ШК -->
	 
	<ClassObject classId="106" className="Shillien Templar" sex="1">
		<ai_type type="b_fighter" sub_type="stupid" />
		<nuke_skills>
			<skill id="401" level="15" is_enchantable="true" is_random="false" ench_max_value="30" ench_route="1"/> <!-- Jugdment -->
		</nuke_skills>
		<rare_nuke_skills>
			<skill id="984" level="25" /> <!-- Shield Strike -->
		</rare_nuke_skills>
		<self_buff_skills>
			<skill id="351" level="1" /> <!-- Magical Mirror -->
			<skill id="913" level="1" /> <!-- Deflect Magic -->
			<skill id="982" level="3" /> <!-- Combat Aura -->
			<skill id="527" level="1" /> <!-- Iron Shield -->
			<skill id="788" level="1" /> <!-- Pain of Shilen -->
		</self_buff_skills>
		<situation_skills>
			<skill id="789" level="1" target="self" cond="skill;5564;3"/> <!-- Spirit os Shilen -->
			<skill id="528" level="1" target="self" cond="hp;70;0"/> <!-- Shield of Faith -->
		</situation_skills>
		<ultimate_self_buff_skills>
			<skill id="916" level="4" /> <!-- Shield Deflect Magic -->
		</ultimate_self_buff_skills>
		<debuff_skills>
			<skill id="122" level="15" is_enchantable="true" is_random="false" ench_max_value="30" ench_route="2"/> <!-- Hex -->
			<!-- <skill id="28" level="49" is_enchantable="true" is_random="false" ench_max_value="30" ench_route="2"/>  Aggression -->
			<skill id="402" level="10" is_enchantable="true" is_random="false" ench_max_value="30" ench_route="2"/> <!-- Arrest -->
			<skill id="279" level="5" is_enchantable="true" is_random="false" ench_max_value="30" ench_route="3"/> <!-- Lightning Strike -->
		</debuff_skills>
		<rare_debuff_skills>
			<skill id="985" level="1" /> <!-- Challenge for Fate -->
			<skill id="352" level="1" is_enchantable="true" is_random="false" ench_max_value="15" ench_route="1"/> <!-- Shield Bash -->
			<skill id="342" level="1" is_enchantable="true" is_random="false" ench_max_value="15" ench_route="1"/> <!-- Touch of Death -->
		</rare_debuff_skills>
		<passive_skills>
			<skill id="631" level="6" />	<!-- Emergent Ability - Attack -->
			<skill id="652" level="1" />	<!-- Knight Ability - Defense -->
			<skill id="655" level="1" />	<!-- Enchanter Ability - Barrier -->
			<skill id="651" level="1" />	<!-- Warrior Ability - Haste -->
		</passive_skills>
		<consumble_skills>
			<skill id="6439" level="1" target="self" cond="MP;50;0"/> <!-- MP Potion, бот использует когда MP меньше 50% один раз -->
			<skill id="2166" level="1" target="self" cond="CP;90;0"/> <!-- CP Potion Low, бот использует когда CP меньше 90% -->
		</consumble_skills>
	</ClassObject>
 </list>