<?xml version="1.0" encoding="utf-8"?><!DOCTYPE list SYSTEM "phantomAI.dtd">
<list>

     <!-- Варлорд -->
	 
	<ClassObject classId="89" className="Dreadnought" sex="1">
		<ai_type type="b_fighter" sub_type="stupid" />
		<henna id1="169" id2="30"/>
		<nuke_skills>
			<skill id="995" level="1" /> <!-- Rush Impact -->
			<skill id="48" level="37" /> <!-- Thunder Storm -->
			<skill id="921" level="1" /> <!-- Cursed Pierce -->
		</nuke_skills>
		<rare_nuke_skills>
			<skill id="347" level="1" /> <!-- Earthquake -->
		</rare_nuke_skills>
		<self_buff_skills>
			<skill id="78" level="2" />	<!-- War Cry -->
			<skill id="130" level="2" is_enchantable="true" is_random="false" ench_max_value="30" ench_route="1"/> <!-- Thrill Fight -->
		</self_buff_skills>
		<situation_skills>
			<skill id="181" level="1" target="self" cond="hp;10;0"/> <!-- Revival -->
		</situation_skills>
		<ultimate_self_buff_skills>
			<skill id="917" level="1" /> <!-- Final Secret -->
		</ultimate_self_buff_skills>
		<debuff_skills>
			<skill id="361" level="1" />	<!-- Shock Blast -->
			<skill id="452" level="5" is_enchantable="true" is_random="false" ench_max_value="30" ench_route="1"/>	<!-- Shock Stomp -->
		</debuff_skills>
		<rare_debuff_skills>
			<skill id="116" level="14" is_enchantable="true" is_random="false" ench_max_value="30" ench_route="1"/>	<!-- Howl -->
		</rare_debuff_skills>
		<passive_skills>
			<skill id="631" level="6" />	<!-- Emergent Ability - Attack -->
			<skill id="652" level="1" />	<!-- Knight Ability - Defense -->
			<skill id="655" level="1" />	<!-- Enchanter Ability - Barrier -->
			<skill id="651" level="1" />	<!-- Warrior Ability - Haste -->
		</passive_skills>
		<consumble_skills>
			<skill id="6439" level="1" target="self" cond="MP;50;0"/> <!-- MP Potion, бот использует когда MP меньше 50% один раз -->
			<skill id="2166" level="1" target="self" cond="CP;90;0"/> <!-- CP Potion Low, бот использует когда CP меньше 90% -->
		</consumble_skills>
	</ClassObject>
 </list>